{
  "version": 1,
  "initialized": true,
  "paths": {
    "contract_dir": "api_spec",
    "openapi_spec": "api_spec/openapi.yaml",
    "backend_dir": ".",
    "frontend_dir": "web/nuxt-ui",
    "has_frontend": true
  },
  "integration": {
    "app_module": "cmd/server/main.go",
    "port": 8080
  },
  "git": {
    "partition_check_base": "origin/main"
  },
  "ci": {
    "client_install_cmd": "npm ci",
    "client_check_cmd": "npm run check",
    "backend_install_cmd": "go mod download",
    "backend_test_cmd": "go test ./...",
    "skip_client_job": false,
    "skip_integration_smoke": false,
    "skip_backend_tests": false
  },
  "project": {
    "name": "media-server-pro",
    "goals": "Stream media (video, audio, images) to authenticated users with admin management, HLS transcoding, content moderation, remote source federation, and a Nuxt UI frontend",
    "constraints": "Backend is Go 1.26 + Gin; frontend is Nuxt 3 + @nuxt/ui v3; old Vite frontend in web/frontend/ is legacy (read-only reference). API contract: api_spec/openapi.yaml (validated in CI).",
    "tech_notes": "Go module: media-server-pro. Backend entry: cmd/server/main.go. Routes: api/routes/routes.go. Models: pkg/models/models.go. Handlers: api/handlers/. Business logic: internal/. Frontend (primary): web/nuxt-ui/ (Nuxt 3 + @nuxt/ui v3). Frontend (legacy): web/frontend/ (Vite + TS, comprehensive but being replaced). Embedded SPA served by web/server.go."
  },
  "steering": {
    "sessions": []
  },
  "models": {
    "questions_before_start": [
      "Which loop are we running (backend / frontend / integration / contract extension)?",
      "What is the acceptance criterion for this change?",
      "Are we allowed to change the OpenAPI spec in this session?"
    ]
  },
  "layout": {
    "use_bundled_demo_paths": true,
    "reference_example_prefixes": []
  },
  "prior_agents": {
    "discovered_at": "2026-03-25 00:52 UTC",
    "known_files": [
      ".claude/skills/deep-debug-audit/SKILL.md",
      ".claude/skills/deep-debug-audit/deep-debug-audit.md",
      ".claude/skills/nuxt-ui/SKILL.md",
      ".claude/skills/nuxt-ui/references/components.md",
      ".claude/skills/nuxt-ui/references/composables.md",
      ".claude/skills/nuxt-ui/references/layouts/chat.md",
      ".claude/skills/nuxt-ui/references/layouts/dashboard.md",
      ".claude/skills/nuxt-ui/references/layouts/docs.md",
      ".claude/skills/nuxt-ui/references/layouts/editor.md",
      ".claude/skills/nuxt-ui/references/layouts/page.md",
      ".claude/skills/nuxt-ui/references/theming.md",
      ".cursor/rules/agent-playbook.mdc",
      ".cursor/rules/audit-loop.mdc",
      ".cursor/rules/codacy.mdc",
      ".cursor/rules/duplicate-code-consolidation.mdc",
      ".cursor/rules/mutation-contract-extension.mdc",
      ".cursor/rules/partition-backend.mdc",
      ".cursor/rules/partition-contract.mdc",
      ".cursor/rules/partition-frontend.mdc",
      ".cursor/rules/synthesis-authority.mdc",
      ".cursor/rules/verbose-audit-loop.mdc",
      "CLAUDE.md",
      "docs/CONFIG-NOTES.md"
    ],
    "import_summary": "",
    "framework_path_allowlist": [
      ".claude/",
      ".roo/"
    ]
  }
}
